{
    "$schema": "http://json-schema.org/draft-07/schema",
    "$id": "Schemas/DatabaseSchemas/5e-SRD-StartingEquipment.schema.json",
    "type": "array",
    "items": {
        "title": "StartingEquipmentEntry",
        "type": "object",
        "required": [
            "descriptor",
            "class",
            "starting_equipment",
            "choices"
        ],
        "properties": {
            "descriptor": {
                "$ref": "Schemas/SupportingSchemas/DatabaseEntryDescriptor.schema.json"
            },
            "class": {
                "$ref": "Schemas/SupportingSchemas/DatabaseEntryReference.schema.json"
            },
            "starting_equipment": {
                "type": "array",
                "items": {
                    "$ref": "Schemas/SupportingSchemas/InventoryItemDescriptor.schema.json"
                }
            },
            "choices": {
                "type": "array",
                "items": {
                    "type": "array",
                    "items": {
                        "allOf": [
                            { "$ref": "Schemas/SupportingSchemas/ChoicePool.schema.json" },
                            {
                                "properties": {
                                    "from": {
                                        "items": {
                                            "$ref": "Schemas/SupportingSchemas/InventoryItemDescriptor.schema.json"
                                        }
                                    }
                                }
                            }
                        ]
                    }
                }
            }
        }
    }
}